{
  "authority_boundary": "This receipt records the exact Phase 2 agent findings and Human Steward authorization for GI-HUMAN-GOVERNANCE-TRANSITION-001. It does not activate GI-STEWARD-0002 by itself; effectiveness requires a separate protected authority-schedule integration and protected-main readback.",
  "campaign_id": "GI-HUMAN-GOVERNANCE-TRANSITION-001",
  "human_steward": "fyremael",
  "packet_sha256": "47b0d9e0e61a50b302c3470da9c27ef0b1f0a17453a955d15bd5fe81e0f13171",
  "proposal_authors": [
    "fyremael"
  ],
  "recorded_at": "2026-08-09T06:25:33Z",
  "schema_version": "1.1.0",
  "signoffs": [
    {
      "attestation_record": "https://github.com/grandchallenge/INTELLECT/pull/54#issuecomment-5230104849",
      "attestation_sha256": "9f53c721f7b2ca613bbbf18bdcf3f7a0e38abb65c27b19ee15da5fcc1d1eb5d4",
      "authenticated_at": "2026-08-09T06:13:00Z",
      "authentication_id": "c753b693-0408-464f-a8f8-ca060efbb4dd",
      "office": "adversary",
      "reviewer": "openai-gpt-5.6-sol-gi-human-governance-adversary-r4",
      "reviewer_kind": "agent",
      "session_id": "c753b693-0408-464f-a8f8-ca060efbb4dd"
    },
    {
      "attestation_record": "https://github.com/grandchallenge/INTELLECT/pull/54#issuecomment-5230104782",
      "attestation_sha256": "161943a728e14e19979994eafae9221fccc4b377ddf2a13cc3bead0ac941669f",
      "authenticated_at": "2026-08-09T06:12:57Z",
      "authentication_id": "6a381a18-223e-4f43-b18b-943f3476394a",
      "office": "referee",
      "reviewer": "codex-gpt5-gi-human-governance-referee-r4",
      "reviewer_kind": "agent",
      "session_id": "6a381a18-223e-4f43-b18b-943f3476394a"
    },
    {
      "attestation_record": "https://github.com/grandchallenge/INTELLECT/pull/54#issuecomment-5230121570",
      "attestation_sha256": "44ed35e2f202693a8e08e6227a7e380d6291d8cbb004c8d7c655502d0d7bca8d",
      "authenticated_at": "2026-08-09T06:20:28Z",
      "authentication_id": "394993397",
      "office": "human_steward",
      "reviewer": "fyremael",
      "reviewer_kind": "human",
      "session_id": null
    }
  ],
  "staffing_mode": "steward_supervised_agents",
  "status": "complete",
  "subjects": [
    {
      "head_sha": "4948714275da49bc3c2933f460dedaea4d0ef3a5",
      "pull_request": 54,
      "repository": "grandchallenge/INTELLECT"
    }
  ]
}
