{
  "authority_boundary": "This receipt records separated agent findings and Human Steward authorization. It does not merge or activate the proposal; admission remains a separate reviewed pull request.",
  "campaign_id": "GI-AMEND-0001",
  "human_steward": "fyremael",
  "packet_sha256": "22dbfa0ea0e652161126dd4647477036b89e6c13ecbd9101cda60ce00e9f95c5",
  "proposal_authors": [
    "fyremael"
  ],
  "recorded_at": "2026-08-03T09:39:25Z",
  "schema_version": "1.1.0",
  "signoffs": [
    {
      "attestation_record": "https://github.com/grandchallenge/gcl-standards/issues/3#issuecomment-5164348042",
      "attestation_sha256": "d67fb238e930eb3f5d5a80cc6f0a4237909e828f3d58750541a9a5305a1ce2a5",
      "authenticated_at": "2026-08-03T09:01:00Z",
      "authentication_id": "gpt-5.6-thinking-final-head-adversary-20260803T090100Z-71afd1db",
      "office": "adversary",
      "reviewer": "openai-gpt-5.6-thinking-final-head-adversary",
      "reviewer_kind": "agent",
      "session_id": "gpt-5.6-thinking-final-head-adversary-20260803T090100Z-71afd1db"
    },
    {
      "attestation_record": "https://github.com/grandchallenge/gcl-standards/issues/3#issuecomment-5164535200",
      "attestation_sha256": "11eba4cfe0e6ca57162076c2bfacfe9417ed32e9fde2b3cd54481a406594e168",
      "authenticated_at": "2026-08-03T09:21:00Z",
      "authentication_id": "gpt-5.6-thinking-final-head-referee-20260803T092100Z-71afd1db",
      "office": "referee",
      "reviewer": "openai-gpt-5.6-thinking-final-head-referee",
      "reviewer_kind": "agent",
      "session_id": "gpt-5.6-thinking-final-head-referee-20260803T092100Z-71afd1db"
    },
    {
      "attestation_record": "https://github.com/grandchallenge/INTELLECT/pull/32#issuecomment-5164721769",
      "attestation_sha256": "e7493ffc4ec2eaa80e0a4b5c1293f9d4c138afa3f03e47693a7225a31c5fa41b",
      "authenticated_at": "2026-08-03T09:38:58Z",
      "authentication_id": "391939851",
      "office": "human_steward",
      "reviewer": "fyremael",
      "reviewer_kind": "human",
      "session_id": null
    }
  ],
  "staffing_mode": "steward_supervised_agents",
  "status": "complete",
  "subjects": [
    {
      "head_sha": "f1f5c4459def29139240c67ca858126021d1f12f",
      "pull_request": 32,
      "repository": "grandchallenge/INTELLECT"
    },
    {
      "head_sha": "fa90ffc2bd23a6b0c8e184c7da2dd6ef1174a4ee",
      "pull_request": 18,
      "repository": "grandchallenge/gcl-standards"
    }
  ]
}
